URL,Title,Views,Likes,Comments,Upload Date,Duration,Description
https://www.youtube.com/watch?v=wLmeTd680g0&pp=ygUSc3ViaGFuIGFsaSBzY3JhcGVy,Instagram Scraper | Bing + Selenium Automation with Python - YouTube,29 views,1,0,29 views  4 days ago  #WebScraping #PythonAutomation #OpenSourceTools,1m 30s,🔍 Instagram Scraper (Bing + Selenium) – Full Demo
https://www.youtube.com/watch?v=MKZG7XTtqrU&pp=ygUSc3ViaGFuIGFsaSBzY3JhcGVy,"TradingView Screener Scraper in Python | Extract Crypto, Stocks, ETFs using API + Save to CSV - YouTube",23 views,0,0,23 views  3 days ago  #tradingview #webscraping #pythonautomation,59s,"📊 This Python script scrapes TradingView screener data (crypto, stocks, ETFs, CEX, DEX) using TradingView’s internal API and saves the output to CSV files.

🧠 It supports:"
https://www.youtube.com/watch?v=BibA3hOS3m8&pp=ygUSc3ViaGFuIGFsaSBzY3JhcGVy,Real-Time Cookie Extractor for Web Scraping | Bypass Cookie Expiry with Selenium (Python Automation) - YouTube,15 views,4,2,15 views  1 day ago  #webscraping #pythonautomation #selenium,30s,"🔥 Tired of expired cookies during long-running scraping tasks?

In this video, I’ll show you how to extract *real-time cookies* using Selenium and Python to keep your scraping sessions alive — no more expired tokens or broken scripts."
https://www.youtube.com/watch?v=u4PV3uRqpR0&pp=ygUSc3ViaGFuIGFsaSBzY3JhcGVy,"YouTube Scraper Python | Scrape Views, Likes, Comments, Channel Info | No API Needed! - YouTube",15 views,1,0,15 views  1 day ago  #WebScraping #YouTubeAutomation #PythonProject,2m 35s,"Scrape YouTube video and channel data without using any API key! This YouTube Scraper tool is built in Python using Selenium and helps you extract:

✅ Video title, views, likes, comments, duration"
https://www.youtube.com/watch?v=bUxd3jqCr94&pp=ygUHbXIgYmVhbg%3D%3D,Green Bean | Mr Bean | Cartoons for Kids | WildBrain Kids - YouTube,64M views,283K,,64M views  3 years ago,31m 5s,➡️️ Make sure to SUBSCRIBE to WildBrain today to catch your favourite show uploads EVERY DAY http://bit.ly/WildBrainTVSub
https://www.youtube.com/watch?v=JYNyQcblzgI&pp=ygUHbXIgYmVhbg%3D%3D,ARMCHAIR Bean | Funny Clips | Mr Bean Official - YouTube,157M views,1.1M,"15,561",157M views  5 years ago,15m 4s,"Mr Bean finds an innovative way to get his armchair home from the sale...

Stay tuned:"
https://www.youtube.com/watch?v=rn43IdibP88&pp=ygUHbXIgYmVhbg%3D%3D,Bean's Favourite Tree Is Being Chopped | Mr Bean Animated | Full Episode Compilation | Mr Bean World - YouTube,32K views,168,,32K views  9 days ago  #MrBeanAnimated #MrBean #MrBeanWorld,55m 1s,Mr Bean is showing Irma his favourite tree in the park one day when he discovers a tree surgeon getting ready to cut it down. He darts up the tree and won’t come back down.
https://www.youtube.com/watch?v=zfMvY41wmtM&pp=ygUHbXIgYmVhbg%3D%3D,A Royal Makeover 👑 | Mr. Bean Animated | Cartoons For Kids | WildBrain Bananas - YouTube,81K views,183,,81K views  1 month ago,544m 6s,➡️️➡️️➡️️ Subscribe to Cartoons for Children -    / @wildbrainbananas
https://www.youtube.com/watch?v=6qD6-zSsmy8&pp=ygUHbXIgYmVhbg%3D%3D,Scientist Bean! | Mr Bean Animated Season 1 | Full Episodes | Mr Bean Official - YouTube,846K views,4.2K,192,846K views  3 months ago,86m 7s,"When Mr. Wicket gets a new lodger who is an Inventor, and a big nuisance, Bean discovers that he has to become ‘inventive’ himself...

Follow the classic adventures of Mr Bean as he navigates his way through the hilarious trials and tribulations of everyday life. Mr Bean uses his unusual wit to fulfil everyday tasks but more often"
https://www.youtube.com/watch?v=2bLKZg-muNg&pp=ygUHbXIgYmVhbg%3D%3D,Mr Bean Becomes Mrs Wicket's Servant | Mr Bean Animated | Full Episode Compilation | Mr Bean World - YouTube,2.8M views,14K,63,2.8M views  3 months ago  #MrBeanAnimated #MrBean #MrBeanWorld,55m 2s,"Mr. Bean becomes Mrs. Wicket’s house-mate when he suffers a flea infestation. Will they get on?

#MrBean #MrBeanAnimated #MrBeanWorld"
https://www.youtube.com/watch?v=nIHyr_fp_yI&pp=ygUHbXIgYmVhbg%3D%3D,Mr Bean Goes Shopping... | Mr Bean Live Action | Funny Clips | Mr Bean - YouTube,31M views,126K,"4,571",31M views  1 year ago,46m 32s,"Mr. Bean goes to a department store and buys various items. But soon finds himself in a rather unusual situation...

Follow the classic adventures of Mr Bean as he navigates his way through the hilarious trials and tribulations of everyday life. Mr Bean uses his unusual wit to fulfil everyday tasks but more often"
https://www.youtube.com/watch?v=HOYpAgWPTps&pp=ygUHbXIgYmVhbg%3D%3D,Ice Cream | Funny Episodes | Mr Bean Cartoon World - YouTube,100M views,488K,"6,237",100M views  6 years ago,40m 52s,"Subscribe - https://www.youtube.com/subscription_...

To find out more about Mr Bean visit:"
https://www.youtube.com/watch?v=Nm5ED9jXuyA&pp=ygUHbXIgYmVhbg%3D%3D,Mr. Bean Joins Squid Game 2 - YouTube,12M views,60K,999,12M views  2 years ago  #mrbean #squidgame #memes,2m 5s,"Mr. Bean wants to play squid game again, so he travels to multiverse to finish squid  game to win the game

Thank you for the green screens :)"
https://www.youtube.com/watch?v=kJS9ViONCRc&pp=ygUHbXIgYmVhbg%3D%3D,TRAVEL Bean | Mr Bean Full Episodes | Mr Bean Official - YouTube,43M views,193K,"4,708",43M views  5 years ago,46m 20s,"Where is Mr Bean travelling to today!

Stay tuned:"
https://www.youtube.com/watch?v=6UWcazW0khE&pp=ygUHbXIgYmVhbg%3D%3D,When You Don't Want To Wake Up ! | Mr Bean Full Episodes | Mr Bean Official - YouTube,22M views,138K,"3,036",22M views  2 years ago,74m 49s,"Mr Bean Doesn't Want To Wake Up ! | Mr Bean Full Episodes | Mr Bean Official

It is really hard to wake up Mr Bean!"
https://www.youtube.com/watch?v=LN_7UC1kfcA&pp=ygUHbXIgYmVhbg%3D%3D,Mr Bean Enjoys Jail! | Mr Bean Animated Season 1 | Full Episodes | Mr Bean Official - YouTube,5M views,16K,415,5M views  2 months ago,86m 8s,"Mistaken for an escaped convict, Bean is carted off to jail where he finds that, with a little imagination, prison can be quite nice actually. 

Follow the classic adventures of Mr Bean as he navigates his way through the hilarious trials and tribulations of everyday life. Mr Bean uses his unusual wit to fulfil everyday tasks but more often"
https://www.youtube.com/watch?v=IQzDaJfnCvQ&pp=ygUHbXIgYmVhbg%3D%3D,The Hospital Isn't As Nice As It Seems... | Mr Bean Animated Season 1 | Full Episodes | Mr Bean - YouTube,4.3M views,15K,376,4.3M views  2 months ago,86m 6s,"Envious of all the attention his landlady is receiving because of a broken leg, Mr. Bean decides to 'break' his leg too.

Follow the classic adventures of Mr Bean as he navigates his way through the hilarious trials and tribulations of everyday life. Mr Bean uses his unusual wit to fulfil everyday tasks but more often"
https://www.youtube.com/watch?v=HF48Ur2dbMM&pp=ygUHbXIgYmVhbg%3D%3D,LONDON Bean | Funny Episodes | Mr Bean Cartoon World - YouTube,33M views,137K,"1,160",33M views  5 years ago  #MrBean #London #Animated,44m 17s,"Mr Bean explores London using his own special technology!

Subscribe - https://www.youtube.com/subscription_..."
https://www.youtube.com/watch?v=gxbRnnucIPU&pp=ygUHbXIgYmVhbg%3D%3D,Mr Bean Enters A Pie Eating Competition! |Mr Bean Animated | Full Episodes | Mr Bean World - YouTube,4.7M views,13K,,4.7M views  10 months ago  #MrBeanAnimated #MrBean #MrBeanWorld,55m 0s,Mr Bean enters a competition to win a trolley of free food!
https://www.youtube.com/watch?v=t0Q2otsqC4I&pp=ygUHbXIgYmVhbg%3D%3D,Tom & Jerry | Tom & Jerry in Full Screen | Classic Cartoon Compilation | WB Kids - YouTube,"805,547,121 views","1
2
 .
7
8
 M",,"805,547,121 views  3 years ago  #KidsCartoons #WBKids #TomandJerry",21m 38s,Did you know that there are only 25 classic Tom & Jerry episodes that were displayed in a widescreen CinemaScope from the 1950s? Enjoy a compilation filled with some of the bes
https://www.youtube.com/watch?v=gbsgbcd_-2U&pp=ygUHbXIgYmVhbg%3D%3D,PAW Patrol Rescue Wheels Adventures! #7 w/ Chase 🚗 2 Hours | Nick Jr. - YouTube,44M views,110K,,44M views  6 months ago  #RescueWheels #VehiclesForKids #PAWPatrol,119m 18s,"The PAW Patrol pups are ready for action in this Rescue Wheels 120 minute compilation! Which vehicle quests will Chase, Rocky, Marshall, Skye, and the rest of the pups go on? Today the"
https://www.youtube.com/watch?v=c-RDiM9rWoE&pp=ygUHbXIgYmVhbg%3D%3D,"Mr Bean - Mind The Baby, Mr. Bean | S01 E09 | Classic Mr Bean - YouTube",15M views,63K,"1,321",15M views  2 years ago  #classicbean #MrBean #ClassicMrBean,25m 2s,"#MrBean #ClassicMrBean  

Mr. Bean spends a rather unusual day at a Funfair attraction with a rather unusual baby which he accidentally found. Mr. Bean tries to find ways to keep the baby occupied while he goes on his rid"
https://www.youtube.com/watch?v=5aBJEWTSjLU&pp=ygUHbXIgYmVhbg%3D%3D,Sniper Bean... | Mr Bean Live Action | Full Episodes | Mr Bean - YouTube,2.8M views,20K,423,2.8M views  2 months ago,51m 2s,"How Mr Bean turns off the lights every night...

Follow the classic adventures of Mr Bean as he navigates his way through the hilarious trials and tribulations of everyday life. Mr Bean uses his unusual wit to fulfil everyday tasks but more often"
